,alias,concept_class,def_event_stamp,def_id,def_id_user,definition_text,event_stamp,id,id_concept_class,id_user,name,relationships,type
624,,,2013-04-01 17:52:06,def_5159c94667b3c,usr_4de5345b3b6a8,"Processes by which the probability and benefits of a prospective outcome are computed and calibrated by reference to external information, social context (e.g., group input, counterfactual comparisons), and/or prior experience. This calibration is influenced by pre-existing biases, learning, memory, stimulus characteristics, and deprivation states. Reward valuation may involve the assignment of incentive salience to stimuli.",2013-04-01 17:52:06,trm_5159c94667677,,usr_4de5345b3b6a8,reward valuation,"[{u'direction': u'child', u'id': u'trm_4b6525253c63f', u'relationship': u'part of'}, {u'direction': u'parent', u'id': u'trm_5159cb12a0f92', u'relationship': u'part of'}]",concept
625,,,2012-03-29 01:27:15,def_4f73ba733b34b,usr_49a467bf4e0db,"Movement marked by the regulated succession of strong and weak elements, or of opposite or different conditions.  While rhythm most commonly applies to sound, such as music and spoken language, it may also refer to visual presentation, as timed movement through space.",2009-06-22 19:12:56,trm_4a3fd79d0afc3,ctp_C1,usr_0000000000,rhythm,,concept
626,,,2015-09-09 00:42:29,def_55ef80751f8fd,usr_51bc76ae9636c,Performance of an action using the right finger in accordance with task demands.,2015-07-27 23:04:48,trm_55b6b910b4b23,,usr_51bc76ae9636c,right finger response execution,"[{u'direction': u'parent', u'id': u'trm_557b4a7315f1b', u'relationship': u'kind of'}]",concept
627,,,2015-09-08 22:57:12,def_55ef67c8dcdb2,usr_51bc76ae9636c,Performance of an action with the right hand in accordance with task demands.,2015-06-25 22:05:39,trm_558c7b337080f,,usr_51bc76ae9636c,right hand response execution,"[{u'direction': u'parent', u'id': u'trm_557b4a7315f1b', u'relationship': u'kind of'}]",concept
628,,,2015-09-09 00:43:19,def_55ef80a7c769c,usr_51bc76ae9636c,Performance of an action using the right toe in accordance with task demands.,2015-07-27 23:05:54,trm_55b6b952c1b4c,,usr_51bc76ae9636c,right toe response execution,"[{u'direction': u'parent', u'id': u'trm_557b4a7315f1b', u'relationship': u'kind of'}]",concept
629,,,2013-09-21 21:06:19,def_523e0a4b5ac28,usr_51bc76ae9636c,unable to stray from a particular pattern of behavior or thought,2013-09-21 21:06:19,trm_523e0a4b443dc,,usr_51bc76ae9636c,rigidity,"[{u'direction': u'parent', u'id': u'trm_523e0419ec219', u'relationship': u'kind of'}]",concept
630,,,2015-08-28 18:18:46,def_55e0a60623a51,usr_55dcefd8b28c0,"Formally and mathematically speaking, the minimal definition of risk is what (Rothschild and Stiglitz, 1970) call a mean-preserving increase in dispersion. A typical example is a gamble offering $400 or $600 based on the outcome of a coin flip (i.e. with equal probability (50%)); this is less risky as compared to a similar gamble offering $200 or $800 [again depending on the outcome of a coin flip]. Notice here that the mean outcome (or “expected value”) remains the same for both gambles.

Thus risk can increase by keeping both the probabilities and the expected value the same. 

There are other approaches to risk that are less mathematically stringent but have higher ecological validity. For instance increasing the probability of a (positive outcome) is associated with a reduced perception of risk. Notice though now that the expected value (or the mean outcome) also increases. So, it is difficult in that case to disentangle the two metrics.

Many times  the term risk is associated with the probability of a negative outcome, or what is formally called downside risk. This idea is mostly due to the way actuarial science and insurance companies (which are more interested in the negative aspects of risk) use the term. For instance, the statement, “now we increase the risk,” might be translated as taking more perilous actions, but formally, this is not the case. The point of risk is that the opportunity also increases (“upside” risk). Thus, a situation that is riskier can be attractive, especially if the agent focuses on the positive outcomes.

Another approach is the so-called “moment-based” approach. Here, one is interested in the second or higher moments of a distribution, roughly corresponding to variance, skewness and kurtosis. Skewness is of particular interest because it seems that risk-seeking persons (gamblers) can be attracted by positively skewed outcomes. Bets that offer a small probability of a high outcome are  attractive to gamblers (Garrett and Sobel, 1999).

Overall, risk is not a unitary concept and should be very carefully defined.

Note that the term risk as used here should be distinguished from the way the term is used in sentences such as ""risk of developing Parkinson&#39;s disease"". An epidemiologist could help on the definition in that context.

Input by other contributors:
the probability or likelihood that an event will occur; possibility of loss or injury; someone or something that creates or suggests a hazard; the chance that an investment will lose value.",2009-06-22 19:12:56,trm_4a3fd79d0afcf,ctp_C3,usr_0000000000,risk,"[{u'direction': u'parent', u'id': u'trm_4a3fd79d0a038', u'relationship': u'part of'}]",concept
631,,,2015-11-09 00:07:48,def_563fe3d4b5d77,usr_51bc76ae9636c,"when exposed to uncertainty, behavior that attempts to reduce that uncertainty. 

BEHAVIORAL PHENOMENA",2015-08-14 22:55:00,trm_55ce71c47f37b,,usr_51bc76ae9636c,risk aversion,"[{u'direction': u'parent', u'id': u'trm_557b4a913f8cc', u'relationship': u'part of'}]",concept
632,"danger processing, threat processing",,2015-12-30 16:57:07,def_56840ce386861,usr_49a467bf4e0db,the extraction of information about the potential or current risk associated with a stimulus,2015-06-12 21:09:37,trm_557b4a913f8cc,ctp_C3,usr_51bc76ae9636c,risk processing,"[{u'direction': u'child', u'id': u'trm_55ce71c47f37b', u'relationship': u'part of'}, {u'direction': u'child', u'id': u'trm_4a3fd79d0b64e', u'relationship': u'part of'}]",concept
633,,,2015-11-09 00:07:29,def_563fe3c160d18,usr_51bc76ae9636c,"The willingness of an individual to choose an option with a less-than-certain probability of reward over an option with a certain reward of equal or higher expected value. 

BEHAVIORAL PHENOMENA",2009-06-22 19:12:57,trm_4a3fd79d0b64e,ctp_C3,usr_0000000000,risk seeking,"[{u'direction': u'parent', u'id': u'trm_557b4a913f8cc', u'relationship': u'part of'}]",concept
634,,,2011-08-12 19:17:07,def_4e457c33ca198,usr_4e429d2c8a0e5,is represented as a series of directions to follow to get from one place to another.,2009-06-22 19:12:56,trm_4a3fd79d0afda,,usr_0000000000,route knowledge,"[{u'direction': u'child', u'id': u'trm_4a3fd79d0b1d5', u'relationship': u'part of'}, {u'direction': u'parent', u'id': u'trm_4a3fd79d0a746', u'relationship': u'kind of'}]",concept
635,,,2011-05-10 21:42:43,def_4dc9b153a0446,usr_4b9003ea0be96,a regular course of procedure; habitual or mechanical performance of an established procedure; a reiterated speech or formula; a sequence of computer instructions for performing a particular task.,2009-06-22 19:12:56,trm_4a3fd79d0afe6,,usr_0000000000,routine,,concept
636,,,2012-03-29 01:28:27,def_4f73babbc0ca5,usr_49a467bf4e0db,a method for performing a psychological operation,2009-06-22 19:12:56,trm_4a3fd79d0aff2,,usr_0000000000,rule,,concept
637,,,2011-08-12 19:35:05,def_4e4580696c913,usr_4e429d2c8a0e5,"process in which a participant gradually acquires knowledge about a fixed but unstated standard that defines, for example, the acceptability of a response or membership of category",2009-06-22 19:12:56,trm_4a3fd79d0affd,ctp_C5,usr_0000000000,rule learning,"[{u'direction': u'child', u'id': u'trm_4a3fd79d0a05b', u'relationship': u'part of'}, {u'direction': u'parent', u'id': u'trm_4a3fd79d0a7bb', u'relationship': u'kind of'}, {u'direction': u'parent', u'id': u'trm_4a3fd79d09c28', u'relationship': u'part of'}]",concept
638,,,2011-08-12 19:59:49,def_4e4586355f4fa,usr_4e429d2c8a0e5,"an emotion  characterized by feelings of unhappiness, disadvantage, loss, and helplessness.",2009-06-22 19:12:56,trm_4a3fd79d0b014,ctp_C8,usr_0000000000,sadness,"[{u'direction': u'parent', u'id': u'trm_4a3fd79d0a17f', u'relationship': u'kind of'}, {u'direction': u'parent', u'id': u'trm_557b48d40d3cf', u'relationship': u'kind of'}]",concept
639,,,2011-08-12 20:06:31,def_4e4587c74aa80,usr_4e429d2c8a0e5,a parameter of a stimulus that indexes its effectiveness.,2009-06-22 19:12:56,trm_4a3fd79d0b020,,usr_0000000000,salience,"[{u'direction': u'parent', u'id': u'trm_4a3fd79d0b4cd', u'relationship': u'part of'}]",concept
640,,,2012-03-29 01:29:43,def_4f73bb0789223,usr_49a467bf4e0db,a structured representation that includes a particular organized way of perceiving and responding to a complex situation or set of stimuli.,2009-06-22 19:12:56,trm_4a3fd79d0b02c,ctp_C3,usr_0000000000,schema,"[{u'direction': u'parent', u'id': u'trm_4a3fd79d0ab7c', u'relationship': u'part of'}, {u'direction': u'parent', u'id': u'trm_4a3fd79d0adb7', u'relationship': u'part of'}]",concept
641,,,2015-09-18 16:54:03,def_55fc41ab14f49,usr_51bc76ae9636c,"to look into or over carefully or thoroughly in an effort to find or discover something; to look through or explore by inspecting possible places of concealment or investigating suspicious circumstances; to look at as if to discover or penetrate intention or nature; to uncover, find, or come to know by inquiry or scrutiny.",2009-06-22 19:12:56,trm_4a3fd79d0b037,ctp_C2,usr_0000000000,search,"[{u'direction': u'child', u'id': u'trm_4a3fd79d0b4cd', u'relationship': u'kind of'}, {u'direction': u'child', u'id': u'trm_4a3fd79d0b0c8', u'relationship': u'kind of'}]",concept
642,"controlled attention, directed attention",,2011-08-17 16:56:16,def_4e4bf2b01caa4,usr_4e429d2c8a0e5,"When multiple external sensory inputs are present, the process of dedicating cognitive and perceptual resources to one type/set of input and attenuating receptiveness to other inputs.",2009-06-22 19:12:56,trm_4a3fd79d0b043,ctp_C2,usr_0000000000,selective attention,"[{u'direction': u'child', u'id': u'trm_557b4abe521af', u'relationship': u'kind of'}, {u'direction': u'parent', u'id': u'trm_4a3fd79d09902', u'relationship': u'kind of'}, {u'direction': u'parent', u'id': u'trm_557b4aa070c10', u'relationship': u'part of'}]",concept
643,,,2015-10-30 05:35:00,def_56330184c322d,usr_55dcf14c19c7b,Top-down modulation of specific response output or of specific stimuli in the environment. ,2015-06-12 21:09:52,trm_557b4aa070c10,ctp_C4,usr_51bc76ae9636c,selective control,"[{u'direction': u'child', u'id': u'trm_4a3fd79d0b043', u'relationship': u'part of'}, {u'direction': u'child', u'id': u'trm_4a3fd79d0a431', u'relationship': u'part of'}, {u'direction': u'parent', u'id': u'trm_4aae62e4ad209', u'relationship': u'kind of'}]",concept
644,"Self-regulation, willpower, ego strength, self-discipline",,2015-09-21 22:51:14,def_560089e29af0b,usr_51bc76ae9636c,"The effortful control of behaviors, thoughts, or emotions with the aim of increasing the likelihood of attaining long-term over short-term outcomes.",2011-12-14 19:36:45,trm_4ee8facd77dfc,ctp_C4,usr_4ecc2d65a4e04,self control,"[{u'direction': u'child', u'id': u'trm_4b45f467bf238', u'relationship': u'kind of'}, {u'direction': u'child', u'id': u'trm_4a3fd79d09b79', u'relationship': u'kind of'}, {u'direction': u'child', u'id': u'trm_51a690a7492eb', u'relationship': u'kind of'}, {u'direction': u'parent', u'id': u'trm_4aae62e4ad209', u'relationship': u'kind of'}]",concept
645,,,2015-09-21 22:51:27,def_560089eecb742,usr_51bc76ae9636c,"The ability to make judgments about one’s current cognitive or emotional internal states, traits, and/or abilities.",2013-03-28 21:18:18,trm_5154b39a3193d,,usr_4de5345b3b6a8,self knowledge,,concept
646,,,2012-03-29 01:30:15,def_4f73bb274a884,usr_49a467bf4e0db,monitoring of one&#39;s own behavior.,2009-06-22 19:12:56,trm_4a3fd79d0b05e,ctp_C4,usr_0000000000,self monitoring,"[{u'direction': u'parent', u'id': u'trm_4a3fd79d0a94f', u'relationship': u'kind of'}, {u'direction': u'parent', u'id': u'trm_4d7fc7c13b3c0', u'relationship': u'part of'}]",concept
647,,,2015-09-21 22:51:39,def_560089fb97917,usr_51bc76ae9636c,"overt verbalisation of thoughts for the purpose of self motivation, problem solving, reasoning, learning or stress management; a behavior commonly witnessed in sports-people during moments of performance pressure ",2012-02-23 17:09:47,trm_4f4672db34a46,,usr_4f39262a2e81e,self talk,,concept
648,,,2015-09-08 22:34:07,def_55ef625fe6606,usr_51bc76ae9636c,The assignment of a semantic stimulus to one of a set of categories.,2015-06-12 21:10:08,trm_557b4ab076338,,usr_51bc76ae9636c,semantic categorization,"[{u'direction': u'child', u'id': u'trm_4a3fd79d0b87a', u'relationship': u'part of'}, {u'direction': u'parent', u'id': u'trm_4a3fd79d09c28', u'relationship': u'kind of'}]",concept
649,,,2011-04-01 19:50:06,def_4d962c6e8468f,usr_4cf5de07654c8,"is a grouping of vocabulary within a language, organizing words which are interrelated and define each other in various ways. Also referred to as a semantic field.

",2009-06-22 19:12:56,trm_4a3fd79d0b06b,ctp_C6,usr_0000000000,semantic category,,concept
650,semantic knowledge,,2011-08-12 21:10:20,def_4e4596bc8f250,usr_4e429d2c8a0e5,"information that is not tied to any specific object, event, domain, or application. It includes general factual information about the world (as in an encyclopedia) and oneself.",2011-01-03 17:05:25,trm_4d2201d530697,,usr_4d21e54d99087,semantic information,,concept
651,,,2012-03-29 01:31:37,def_4f73bb791b4d0,usr_49a467bf4e0db,"long-established knowledge about objects, facts, and word meanings.",2009-06-22 19:12:56,trm_4a3fd79d0b077,ctp_C6,usr_0000000000,semantic knowledge,"[{u'direction': u'parent', u'id': u'trm_4a3fd79d0a833', u'relationship': u'kind of'}, {u'direction': u'parent', u'id': u'trm_4a3fd79d0a769', u'relationship': u'part of'}]",concept
652,,,2010-05-09 07:46:27,def_4be668537e9c8,usr_4b64af5545a03,"refers to one&#39;s conceptual knowledge and includes the meanings of words, factual information about the world, and other information not related to specific events or episodes",2009-06-22 19:12:56,trm_4a3fd79d0b083,ctp_C6,usr_0000000000,semantic memory,"[{u'direction': u'parent', u'id': u'trm_4a3fd79d0a04f', u'relationship': u'kind of'}, {u'direction': u'parent', u'id': u'trm_4a3fd79d0a769', u'relationship': u'part of'}]",concept
653,ontology,,2015-09-21 20:21:57,def_560066e4d591d,usr_49a467bf4e0db,Set of concepts and relations,2013-05-03 10:04:26,trm_51838baad343e,ctp_C6,usr_4ffbda803dbd6,semantic network,,concept
654,,,2015-04-05 21:11:44,def_5521a51037e64,usr_4e42a3196fbcd,"is where we process stimuli better depending on what comes first.
",2015-04-05 21:11:44,trm_5521a51034353,,usr_4e42a3196fbcd,Semantic priming,"[{u'direction': u'parent', u'id': u'trm_4e89aebaa311d', u'relationship': u'kind of'}]",concept
655,,,2012-03-29 01:32:48,def_4f73bbc0e2454,usr_49a467bf4e0db,"refers to the cognitive processing of the meanings of a stimulus
",2009-06-22 19:12:57,trm_4a3fd79d0b87a,ctp_C6,usr_0000000000,semantic processing,"[{u'direction': u'parent', u'id': u'trm_557b4ab076338', u'relationship': u'part of'}]",concept
656,,,2010-01-10 23:04:12,def_4b4a5cece8e65,usr_49a467bf4e0db,Working memory for meaning,2009-06-22 19:12:56,trm_4a3fd79d0b08f,ctp_C4,usr_0000000000,semantic working memory,"[{u'direction': u'parent', u'id': u'trm_4a3fd79d0b5a7', u'relationship': u'kind of'}]",concept
657,,,2012-06-26 18:05:05,def_4fe9f9d1ce6fb,usr_4f177506dde77,The feeling that something is part of one&#39;s own body.,2011-09-01 15:54:39,trm_4e5faabfe8ce3,,usr_4e4a7f57b30e6,sense of body ownership,"[{u'direction': u'parent', u'id': u'trm_4e5badf095692', u'relationship': u'kind of'}]",concept
658,,,2012-06-26 18:03:28,def_4fe9f9703c961,usr_4f177506dde77,The feeling that something is part of one self.,2011-08-29 15:19:12,trm_4e5badf095692,,usr_4e4a7f57b30e6,sense of ownership,"[{u'direction': u'child', u'id': u'trm_4e5faabfe8ce3', u'relationship': u'kind of'}, {u'direction': u'parent', u'id': u'trm_4e5505361f160', u'relationship': u'kind of'}]",concept
659,"flexibility, tolerance",,2013-10-15 18:48:57,def_525d8e19976b2,usr_51bc76ae9636c,an individual&#39;s ability to withstand changes in his or her environment or situation.,2013-10-15 18:48:57,trm_525d8e198e0da,,usr_51bc76ae9636c,sensitivity to change,,concept
660,sensitivity,,2013-10-15 18:43:29,def_525d8cd1d3f3c,usr_51bc76ae9636c,"a condition defined as having ""a tendency to react negatively or with alarm to sensory input which is generally considered harmless or non-irritating"" to neurotypical people.""",2013-10-15 18:43:29,trm_525d8cd1c9cc3,,usr_51bc76ae9636c,sensory defensiveness,,concept
661,sensory-information store; sensory register,,2011-08-12 21:35:38,def_4e459caaa3115,usr_4e429d2c8a0e5,"brief storage of sensory information in each of the senses, which temporarily holds material (e.g., a perceptual experience) for recoding into another memory (such as short-term memory) or for comprehension.",2009-06-22 19:12:56,trm_4a3fd79d0b09a,ctp_C5,usr_0000000000,sensory memory,"[{u'direction': u'parent', u'id': u'trm_4a3fd79d0a891', u'relationship': u'kind of'}]",concept
662,,,2011-04-12 18:54:01,def_4da49fc9d980b,usr_4cf5de07654c8,"takes place whenever a reader or listener processes a language utterance, either in isolation or in the context of a conversation or a text.",2009-06-22 19:12:57,trm_4a3fd79d0b892,ctp_C6,usr_0000000000,sentence comprehension,"[{u'direction': u'child', u'id': u'trm_4a3fd79d09ad5', u'relationship': u'kind of'}, {u'direction': u'parent', u'id': u'trm_4a3fd79d0a775', u'relationship': u'kind of'}, {u'direction': u'parent', u'id': u'trm_4a3fd79d0a769', u'relationship': u'part of'}]",concept
663,,,2011-04-11 22:23:00,def_4da37f4498619,usr_4cf5de07654c8,"takes place whenever a reader or listener cognitively processes a language utterance, either in isolation or in the context of a conversation or a text.
",2009-06-22 19:12:57,trm_4a3fd79d0b89e,ctp_C6,usr_0000000000,sentence processing,"[{u'direction': u'child', u'id': u'trm_568427366401c', u'relationship': u'kind of'}, {u'direction': u'child', u'id': u'trm_55b6b89222d4c', u'relationship': u'kind of'}, {u'direction': u'child', u'id': u'trm_52b5f1ef4f9cc', u'relationship': u'part of'}, {u'direction': u'child', u'id': u'trm_4a3fd79d0b826', u'relationship': u'part of'}, {u'direction': u'parent', u'id': u'trm_4a3fd79d0b802', u'relationship': u'kind of'}, {u'direction': u'parent', u'id': u'trm_55c6f58e77fbe', u'relationship': u'part of'}]",concept
664,,,2012-03-29 01:35:22,def_4f73bc5ab8e1f,usr_49a467bf4e0db,The creation and/or utterance of a sentence,2009-06-22 19:12:57,trm_4a3fd79d0b8aa,ctp_C6,usr_0000000000,sentence production,,concept
665,,,2015-12-30 18:49:26,def_568427367e9d4,usr_55dcf14c19c7b,assigning a detected sentence into a category (not necessarily task defined),2015-12-30 18:49:26,trm_568427366401c,,usr_55dcf14c19c7b,sentence recognition ,"[{u'direction': u'child', u'id': u'trm_558c7b14c076e', u'relationship': u'kind of'}, {u'direction': u'child', u'id': u'trm_558c7b5228ed4', u'relationship': u'kind of'}, {u'direction': u'parent', u'id': u'trm_4a3fd79d0b89e', u'relationship': u'kind of'}]",concept
666,,,2011-08-17 17:06:58,def_4e4bf532a941a,usr_4e429d2c8a0e5,learning of a sequence of items or responses in the precise order of their presentation.,2009-06-22 19:12:56,trm_4a3fd79d0b0a6,ctp_C5,usr_0000000000,sequence learning,"[{u'direction': u'child', u'id': u'trm_4a3fd79d0a9b9', u'relationship': u'kind of'}, {u'direction': u'parent', u'id': u'trm_4a3fd79d0a7bb', u'relationship': u'kind of'}]",concept
667,,,2009-11-25 16:36:00,def_4b0d5cf003d8b,usr_4a5bc4a2a8aba,The process of acquiring information in sequence and following an order that must be preserved at recall.,2009-06-22 19:12:56,trm_4a3fd79d0b0b1,ctp_C5,usr_0000000000,serial learning,"[{u'direction': u'parent', u'id': u'trm_4a3fd79d0a275', u'relationship': u'kind of'}]",concept
668,"intermittent processing, sequential processing",,2011-08-19 16:32:01,def_4e4e900188fe0,usr_4e429d2c8a0e5,information processing in which only one sequence of processing operations is carried on at a time.,2009-06-22 19:12:56,trm_4a3fd79d0b0bd,,usr_0000000000,serial processing,,concept
669,,,2009-07-10 21:06:32,def_4a57ad58bc390,usr_4a5bc4a2a8aba,The process of identifying a target within a set of candidate elements by testing the identity of each element against the identity of the sought after target one at a time.,2009-06-22 19:12:56,trm_4a3fd79d0b0c8,ctp_C2,usr_0000000000,serial search,"[{u'direction': u'parent', u'id': u'trm_4a3fd79d0b037', u'relationship': u'kind of'}]",concept
670,"mental set shifting, task set reconfiguration",,2015-11-08 21:15:26,def_563fbb6e11fe1,usr_51bc76ae9636c,disengagement of an irrelevant task set and subsequent engagement of a relevant task set despite interference and/or priming,2009-06-22 19:12:57,trm_4a3fd79d0b607,ctp_C4,usr_0000000000,set shifting,"[{u'direction': u'child', u'id': u'trm_4a3fd79d0a613', u'relationship': u'part of'}, {u'direction': u'child', u'id': u'trm_4a3fd79d0a038', u'relationship': u'part of'}, {u'direction': u'parent', u'id': u'trm_4a3fd79d0b613', u'relationship': u'kind of'}]",concept
671,,,2011-05-11 23:15:06,def_4dcb187a92454,usr_4b9003ea0be96,"a mode of thinking in which one pays attention only to appearances and other superficial aspects of the material, typically leading to poor memory retention.",2009-06-22 19:12:56,trm_4a3fd79d0b0df,,usr_0000000000,shallow processing,,concept
672,,,2011-05-12 22:24:59,def_4dcc5e3b50de0,usr_4b9003ea0be96,"a painful emotion caused by consciousness of guilt, shortcoming, or impropriety; a condition of humiliating disgrace or disrepute; something that brings censure or reproach.",2009-06-22 19:12:56,trm_4a3fd79d0b0eb,ctp_C8,usr_0000000000,shame,"[{u'direction': u'parent', u'id': u'trm_4a3fd79d0a17f', u'relationship': u'kind of'}]",concept
673,,,2015-04-23 21:45:20,def_553967f064275,usr_51bc76ae9636c,the ability to perceive a shape,2015-04-23 21:45:20,trm_553967f006b70,,usr_51bc76ae9636c,shape recognition,"[{u'direction': u'parent', u'id': u'trm_4a3fd79d0aab0', u'relationship': u'kind of'}]",concept
674,,,2011-08-19 16:46:00,def_4e4e93481c545,usr_4e429d2c8a0e5,"A limited-capacity and short-lasting representation of information in the mind. The duration of short-term memory is on the order of seconds, while its capacity is on the order of 4 to 9 independent items.",2009-06-22 19:12:56,trm_4a3fd79d0b0f7,ctp_C5,usr_0000000000,short term memory,"[{u'direction': u'child', u'id': u'trm_4a3fd79d0ba54', u'relationship': u'part of'}, {u'direction': u'parent', u'id': u'trm_4a3fd79d0a891', u'relationship': u'kind of'}]",concept
675,,,2011-04-28 19:20:42,def_4db9be0a65a68,usr_4b9003ea0be96,an attitude of doubt or a disposition to incredulity either in general or toward a particular object.,2009-06-22 19:12:56,trm_4a3fd79d0b10e,,usr_0000000000,skepticism,,concept
676,,,2015-09-18 16:52:12,def_55fc413c2d86e,usr_51bc76ae9636c," Proficiency, facility, or dexterity that is acquired or developed through training or experience.",2009-06-22 19:12:56,trm_4a3fd79d0b11a,ctp_C5,usr_0000000000,skill,"[{u'direction': u'child', u'id': u'trm_4a3fd79d0aeaa', u'relationship': u'kind of'}]",concept
677,skill learning,,2012-03-29 01:38:04,def_4f73bcfc1c871,usr_49a467bf4e0db,The process of learning to perform a task or set of tasks with increasing facility. Typically implies the formation of procedural (as distinct from semantic or episodic) memories.,2009-06-22 19:12:56,trm_4a3fd79d0b125,ctp_C5,usr_0000000000,skill acquisition,"[{u'direction': u'parent', u'id': u'trm_565bce2791089', u'relationship': u'kind of'}]",concept
678,,,2013-04-01 17:42:37,def_5159c70d137dd,usr_4de5345b3b6a8,"Sleep and wakefulness are endogenous, recurring, behavioral states that reflect coordinated changes in the dynamic functional organization of the brain and that optimize physiology, behavior, and health. Homeostatic and circadian processes regulate the propensity for wakefulness and sleep. Sleep is a reversible state, characterized by postural recumbence, behavioral quiescence, and reduced responsiveness. It involves predictable cycling of non-rapid eye movement (NREM) and rapid eye movement (REM). It is affected by experiences during wakefulness, and has restorative and transformative effects that optimize neurobehavioral functions during wakefulness.",2013-04-01 17:42:37,trm_5159c70d0e98e,,usr_4de5345b3b6a8,sleep,,concept
679,,,2012-03-29 01:38:21,def_4f73bd0d2b25e,usr_49a467bf4e0db,"the encoding, storage, retrieval, and processing, in the brain, of information relating to conspecifics, or members of the same species.",2009-06-22 19:12:56,trm_4a3fd79d0b13d,ctp_C9,usr_0000000000,social cognition,"[{u'direction': u'child', u'id': u'trm_4a3fd79d0b392', u'relationship': u'kind of'}]",concept
680,,,2012-03-29 01:38:34,def_4f73bd1a3918f,usr_49a467bf4e0db,the identical or similar social positions and social roles as a whole that influence the individuals of a group.,2009-06-22 19:12:56,trm_4a3fd79d0b148,ctp_C9,usr_0000000000,social context,,concept
681,,,2015-09-18 16:51:37,def_55fc4119967bc,usr_51bc76ae9636c,write definition here,2015-07-02 22:41:24,trm_5595be14a57c5,ctp_C3,usr_51bc76ae9636c,social inference,"[{u'direction': u'child', u'id': u'trm_5595bda0c5dc3', u'relationship': u'kind of'}, {u'direction': u'parent', u'id': u'trm_4a3fd79d0a5ed', u'relationship': u'kind of'}]",concept
682,,,2012-03-29 01:38:50,def_4f73bd2a27689,usr_49a467bf4e0db,the ability to function successfully in interpersonal situations.,2009-06-22 19:12:56,trm_4a3fd79d0b154,ctp_C9,usr_0000000000,social intelligence,,concept
